{
  "$schema": "https://raw.githubusercontent.com/gavin-k/dropwheel/main/docs/tool-manifest.schema.json",
  "schema": 1,
  "id": "user.hello-pwsh",
  "name": { "zh": "复制一份", "en": "Make a copy" },
  "hint": { "zh": "原样复制，名字加 -copy", "en": "Same file, named -copy" },
  "icon": "E8C8",
  "wheel": "tools",
  "appliesTo": ["image"],
  "kind": "script",
  "script": {
    "command": "pwsh",
    "args": ["-NoProfile", "-ExecutionPolicy", "Bypass", "-File", "{toolDir}\\hello.ps1", "{input}", "{output}"],
    "perFile": true,
    "output": { "mode": "new-file", "extension": "same", "suffix": "-copy" },
    "timeoutSeconds": 60
  },
  "placement": { "group": { "zh": "示例", "en": "Examples" } },
  "undo": "recycle"
}
